created_at,full_text,Sentimen
Sun May 05 13:32:21 +0000 2024,Seumur hidup tak pernah terfikir boleh betul2 boikot McD kfc &amp; nestlé. Sebelum ni pernah ada cubaan boikot masa zaman uni boleh la boikot berapa bulan lepastu rasa mcm tak mungkin lah dapat boikot barang nestlé . McD pun boikot setahun dua tp aiskrim tetap beli.,Netral
Fri Apr 19 14:14:45 +0000 2024,Mmg kita semua patut boikot nestle. Jgn lupa boikot grab juga sbb bini tokey rindu israhell,Netral
Tue May 28 02:00:40 +0000 2024,Aku boikot nama2 besar je yang clearly tak sokong 🇵🇸. Macam starbucks mcd nestle.,Netral
Tue Apr 30 04:46:25 +0000 2024,Camne nak boikot Nestle berebut nak kerja Nestle sebab katanya ada pencen.,Netral
Mon Mar 11 11:18:14 +0000 2024,Rakyat Malaysia malas membaca eh. Ada content creator up recipe kat IG siap tnjuk and mention pakai nestum timbang tu. Bkn nestle. Tapi semua Netizen Duk Komen kena boikot nestum bla bla. Bacaa dulu dik. Kat caption pun ada. Video tgk smpai abes dik ,Netral
Sat May 18 01:33:56 +0000 2024,@muhammadnajib79 Bodoh. Walaupun AEON jual nestle aku tak boikot. Aku masuk AEON beli apa yg aku nak selain nestle. Sbb aku boikot nestle bukan AEON. Biar tak hensem tapi jgn bingai bro.,Netral
Sat Mar 09 04:19:43 +0000 2024,Gituuu duk komen ckp tak boikot masuk neraka. Terasa nyah sbb anak gue ni minum susu nestle je ,Netral
Wed May 15 10:39:23 +0000 2024,Boikot ni bukanlah bermaksud kesempurnaan tapi atas kemampuan. Kita mungkin tak mampu nak boikot teknologi diorang tapi kita mampu nak boikot produk makanan dan minuman diorang. Jadi tak tak tepat kalau orang kata Kalau awak boikot Nestle jangan guna Intel sekali. ,Netral
Fri Jun 14 01:52:28 +0000 2024,Bukan ke boikot? Takyah ler beli Nestle biar dia melingkup dengan sendirinya.,Netral
Fri Jun 14 02:06:08 +0000 2024,@_JANGAN_DIAM Masalah? Walaun : Apa bimbang bro dah boikot Nescafé MiLO nestle products . Tak rasa pun . Banyak Kai boleh pilih.,Netral
Fri Apr 26 07:25:08 +0000 2024,@IzzytheNomad Nestle kut. Boikot Nestle. Time lapar takleh pikir dah semua tu.,Netral
Wed Mar 27 20:12:15 +0000 2024,Tadi elok je aku beli dutch lady husb tanya taknak boikot ke? Aku tanya boikot apa? Dutch lady ni nestle ke Husb: Boikot KK mart lah Hahahaha aku ingatkan suruh boikot dutch lady sedap aku minum,Netral
Thu May 16 01:48:24 +0000 2024,https://t.co/piF1ZpIkuD Dekat sini pun wipro unza brands tak kena boikot termasuklah cetaphil Tapi kalau ada supported document stated they have link towards israel macam cetaphil bcs of nestle. So atas diri sendiri jela kot,Netral
Wed May 29 11:42:35 +0000 2024,Udah sejak awal boikot udah ninggalin produk Unilever dan nestle sekarang pake wings terus.,Netral
Tue Dec 26 03:53:56 +0000 2023,Jap product prego &amp; san remo ni kena boikot tak ? I tanya sbb serious tak tahu. Tahu kena boikot big brand je. Nestle mcd sb cadbury pun en ahh milo .haa ni jela tahu ,Netral
Wed Apr 24 09:37:49 +0000 2024,@_mardial_ Dari belasan tahun lalu issue boikot produk Israel (Unilever nestle dll) udah ada dan belum booming ky sekarang ulama Saudi dan turunannya salah satu yg banyak kasih fatwa kl boikot itu pilihan personal dan tetap boleh konsumsi barang itu skrg aja byk yg maksa utk boikot,Netral
Sun May 19 08:51:13 +0000 2024,Ape benda banding Zus dengan Al Ikhsan. Kononnya yang Zus kena boikot sebab tokey dia tak sama kaum dengan tokey Al Ikhsan. Kau ada tengok kita boikot 99Speedmart padahal dalam tu ada je jual Coca Cola Pepsi Nestle Maggi etc ?,Netral
Sun Mar 17 15:22:32 +0000 2024,@Pelabur_Bijak Aku boikot McD tapi aku beli kat Mary Brown. Aku boikot Starbucks tapi aku beli kat ZUS. Aku boikot Nestle ice cream tapi aku beli King ice cream. Ekonomi jalan teruih.,Netral
Sun May 12 11:21:42 +0000 2024,ye faham nak boikot tapi tak payah lah over nauuu sampai nak hina orang kau boikot kfc tapi pakai nestle dia boikot nestle tapi makan kfc. so last last korang dua sama ye je. takde yang lebih baik pun. focus je lah pada amalan masing masing.,Netral
Tue Feb 20 06:05:25 +0000 2024,Sabasun boikot sepenuhnya produk berkaitan Israel bermula Mac Ia termasuk produk daripada jenama terbesar Nestle yang sebelum ini terdapat di premis berkenaan. - Sabasun #sinarharian #Sabasun #boikotproduk #Israel https://t.co/NkyeKUyQjP,Netral
Fri Apr 26 08:40:38 +0000 2024,Anjing israel. Expect apa. Aku rasa diorang buat experiment worldwide ni nak tengok kesan dia. Obviously gula tak elok untuk manusia apatah lagi baby. Boikot terus Nestle ni dan segala mak bapak produk dia. Milo tu pun penuh gula. Sihat kepala otak dia.,Netral
Tue Apr 30 09:12:25 +0000 2024,QSR Brands terpaksa gantung 100 cawangannya akibat orang boikot makan ayam KFC. Tapi takde berita pula tentang Nestle menanggung kerugian hingga tutup cawangan. Apakah orang ramai terlupa bahawa Nestle penyokong rejim Zionist Israel?,Netral
Fri Jun 14 02:05:31 +0000 2024,@_JANGAN_DIAM Lah kata boikot Nestle? Nak risau apa? Gila,Netral
Tue Apr 30 07:21:22 +0000 2024,tengah orang cakap pasal boikot ni aku tengok Nestle tak terkesan sangat walaupun ada bunyi kena dan patut boikot. sebelum Gaza (3Q23) revenue/sales RM1.77 bilion 4Q23 turun sikit RM1.68 bilion 1Q24 naik RM1.78 bilion. lepas tu siap boleh naik harga sebab kos naik ,Netral
Wed Mar 27 15:45:42 +0000 2024,Kalau ada yg kata boikot jenama pro-Israel sprt @StarbucksMY @McDMalaysia &amp; @Nestle agak keterlaluan lihatlah cara warga Ireland memboikot demi Palestine.. Ada malu juga kita yg konon bersemangat anti-Zionist tak serancak mrk bergerak..,Netral
Thu Jun 13 23:51:37 +0000 2024,@_JANGAN_DIAM Org dah lama boikot Nestle sebab pro Israel.,Netral
Fri May 17 11:05:41 +0000 2024,Aku dah lama boikot nestle ni. Tapi tulah peraduan gaji seumur hidup ni.. betul2 mencabar kesabaran aku,Netral
Fri Jun 14 00:43:16 +0000 2024,@_JANGAN_DIAM Puak ko jugak yg kuat boikot Nestle.. Jangan bodo sangat,Netral
Tue Mar 19 05:48:23 +0000 2024,Walaupun digempur isu boikot tetapi Unilever Indonesia menunjukan kepeduliannya terhadap saudara² di Palestina dengan memberikan donasinya https://t.co/0ftjBWMzba,Netral
Thu Mar 28 09:14:51 +0000 2024,heran deh sama yg masih kemakan hoax boikot jelas2 unilever indonesia udah banyak donasi ke palestina jelas mereka memihak palestina lah https://t.co/wjRvcxaxoM,Netral
Tue Mar 19 06:09:29 +0000 2024,Walaupun udh di fitnah dan di boikot Unilever Indonesia tetap berikan bantuan ke Palestina. Alhamdulillah semoga berkah https://t.co/saJGFoeUf6,Netral
Mon Mar 04 16:44:54 +0000 2024,Gara gara duluan boikot Aice soal kasus tdk memanusiakan karyawannya malah jadi pindah ke walls. Tp karna walls under Unilever skrg makan es krim joyday glico diamond (ga pernah Nemu tp). I hope these brands are safe https://t.co/Oerfwqghi2,Netral
Tue Apr 16 12:59:46 +0000 2024,pas boikot mcd masih biasa aja unilever juga b aja. ehhh pas tau info ini tuu hhaaaa nohoook sekaliiii bay austin #boikotHomescapes #boikotplayrix https://t.co/DUPa2a4Nii,Netral
Fri Apr 05 18:31:58 +0000 2024,Akhirny McDonalds mnyerah dgn grakan boikot d dunia&amp;membeli kmbl gerai2nya yg ad d Israel Efektivitas aksi boikot ini smg jd pnyemangat kita utk lanjut boikot prodk yg msh terafiliasi dg Israel sprt prodk2 Unilever&amp;lain2ny tujuanny agar Israel smakn dikucilkan oleh msyrkt lobal https://t.co/gpd8wY0CE7,Netral
Thu May 30 12:12:25 +0000 2024,Meskipun kita tidak ikut berperan secara langsung tapi Insha Allah ini dapat membantu saudara-saudara kita di Palestina semoga tetap bernilai pahala di mata Allah. Tetap lanjutkan boikot produk yang terafiliasi dengan Israel. #boikot #unilever https://t.co/JMVO6Vmv4e,Netral
Thu Mar 14 12:13:22 +0000 2024,hayooo siapa yang kemarin sibuk ngehina dan boikot Unilever nyatanya Unilever selalu memberikan manfaat dan bantuan untuk sesama https://t.co/d1kULSqqdV,Netral
Thu Mar 14 12:09:13 +0000 2024,Nah yang kayak gini memang patut dicontoh meskipun difitnah dan kena boikot tapi Unilever tetap memberikan manfaat kepada sesama https://t.co/G3f888zhJ3,Netral
Thu Apr 18 15:30:08 +0000 2024,Google otomatis &amp; jelas bantu Israel beli senjata buat membunuh warga Gaza pertinyiinyi beranikah kita memboikot produk2x Google ( email google maps dll) spt boikot KFC McD unilever dll ? Kalau gua sih ga berani krn tanpa google hidup terasa hambar...tiap hari bakal manyun. https://t.co/NEQdciMNXL,Netral
Tue Feb 20 13:00:08 +0000 2024,Di Q4 2023 pasca boikot net profit Unilever turun drastis 57% dari 1.4 triliun jadi 600 miliar. Waktu laporan tahunan Unilever rilis harga sahamnya langsung anjlok ke angka 2.760. Keep boycot sampe merugi https://t.co/ufi6bwLwqD,Netral
Thu May 30 06:23:00 +0000 2024,Star ini produk di bawah Unilever dan mereka itu pro Z jangan lupa di boikot https://t.co/GxfJN8i7FB,Netral
Sun Jun 09 07:45:32 +0000 2024,BUTUH 50 RESPONDEN LAGI!! YUK LUR BANTU ISI Jika kamu: 1. Melakukan pembelian dan konsumsi produk Unilever minimal satu kali sebelum 7 Oktober 2023. 2. Melakukan boikot produk Unilever setelah 7 Oktober 2023. 3. Telah melihat atau membaca berita tentang konflik (cont..) https://t.co/MWI7pzSpJq,Netral
Mon May 06 02:56:01 +0000 2024,&gt; Di Malaysia KFC telah menutup beberapa gerainya &gt; McDonald's mengalami pertumbuhan penjualan hanya 0 7% selama kuartal IV 2023 menurun dibanding thn sebelumnya &gt; Di periode yg sama Unilever mengalami penurunan penjualan hingga 15% Tetap Boikot. https://t.co/nloB3HnqcG,Netral
Sun Mar 31 04:25:11 +0000 2024,Sampai segitu takutnya Unilever. Tetap BOIKOT. Membeli produk mereka sama saja menyumbangkan senjata pembunuh. https://t.co/HV1O2rdHe3,Netral
Thu Mar 21 05:12:25 +0000 2024,Unilever Akan PHK 7.500 Karyawan Terimakasih @Jokowi atas Kenaikan Barang Kebutuhan Pokok Dan Terimakasih atas Warga yg telah Boikot Produk Unilever anda berjasa dalam menambah Penggangguran Saudara SeAgama dan Sebangsa anda sendiri. https://t.co/BnrdHkRn1o,Netral
Fri Mar 15 21:21:32 +0000 2024,Jangan lupa boikot trus ya produk2 Israel dan pendukung Jangan kendor jangan kendor Apalagi Coca cola sprite fanta Unilever milo susu beruang jgn kendor ya n lancarkan rudal https://t.co/ymFhaI70Bb,Netral
Tue Apr 02 11:22:11 +0000 2024,ada 1negara penjajah berdiri di tanah jajahan bebuat seenaknya tidak ada hukum international yang bs menghentikanya yaitu @Israel hannya 1 cara #Boikot @Danone @Disney @Unilever @CocaCola @SbuxIndonesia @McDonalds @kfc @NestleUSA @Dior @sehatAQUA @BurgerKing @LOrealGroupe https://t.co/QBTOqg6Jxb,Netral
Tue Jun 11 05:04:34 +0000 2024,Gak cuman kena boikot Unilever juga kena desakan sama Greenpeace buat tanggung jawab sama sampahnya https://t.co/tvDWpQbk8g,Netral
Tue May 14 17:17:28 +0000 2024,: ramai dok tnya akak ni knp order kfc. like korg pasti rumah korg xde brg sapot israel ke?? ntah² kt rumah mkan maggi nestle pakai sabun dove shampoo unilever skincare garnier loreal. aku pon boikot jugak tp ikut mana yg aku mampu. https://t.co/I5BDeZEbKi,Netral
Sat May 11 03:03:09 +0000 2024,Suka bingung ama zionis pesek yg mempertanyakan nasib pekerja klo kita boikot starbucks mcd unilever dll Padahal mereka ga pernah koar2 soal buruh aice kocak,Positif
Mon Jun 10 11:57:45 +0000 2024,Cek instagram Oppo Indonesia rame bener wkwk Oppo id mending lu buru-buru ambil tindakan tegas BA lu deh sebelum netizen dan masyarakat lebih melek secara luas terhadap kasus yang sedang panas sekarang (Sekelas Unilever Starbuck Kfc aja bisa kalang kabut loh akibat boikot),Netral
Sun Jun 09 04:41:20 +0000 2024,Boikot boikot ini aku sendiri juga sering missed.. Ternyataaa produknya banyak banget. Yang ada di kepala cuma unilever coca cola dkk. Padahal banyak banget.. Gapapa yaaa Milaaaaa... Jangan gaenak hati kalau diingatkan orang lain soal hal ini.. Emang kita hidup di zaman yang,Netral
Wed May 29 11:42:35 +0000 2024,Udah sejak awal boikot udah ninggalin produk Unilever dan nestle sekarang pake wings terus.,Netral
Wed Nov 15 10:53:33 +0000 2023,Saham Unilever Tertekan di Tengah Aksi Boikot Produk Pro-Israel https://t.co/jjiYWMTerV,Netral
Sat Jun 15 13:59:15 +0000 2024,@SoftWarNews Alhamdulillah... Semoga nyamber ke Negara2 lain juga. Jangan lupa boikot Unilever Sabun Lux dan Lifebuoy Pepsodent dan Sunlight,Netral
Sun Jun 09 10:14:35 +0000 2024,genuinely wondering. skrg2 lg rame2nya boikot termasuk unilever. tp kok diliat2 ttp banyak aja ya yg berlomba2 apply kerja di unilever??? agak double standard yh,Netral
Sun Jun 09 06:47:33 +0000 2024,Salut deh sama jastip2 yg konsisten boikot. Buka jastip jxb tp ga datengin booth2 unilever. Luvssss,Netral
Sun May 05 05:25:26 +0000 2024,guyss izin promosi toko punya ayah yaa... https://t.co/D6YcHAxZP1 mungkin kalian mikir ada beberapa produknya yg di boikot tpi jujur guys bahkan MUI ga ngeluarin list barang yg harus di boikot sedangkan Unilever indo pake bahan baku lokal jugaa... #wts #SmallBusiness #help,Netral
Mon Mar 25 00:18:15 +0000 2024,Kadrun itu cuma berani boikot McD KFC dan Starbucks yang jarang mereka beli.sedangkan produk Unilever sampe sekarang aja mereka berani ngak berani boikot karena produk tersebut Ndak bisa lepas dari aktivitas padahal sama-sama produk yahudi,Netral
Sun Jun 09 13:57:09 +0000 2024,produk2nya boikot/terafiliasi secara lingkungannya jg mencemari (mis: unilever) secara kesehatan ga ada bagus2nya (junkfood susu tinggi gula dll dll) ga ada alesan buat ga boikot sbnernya,Positif
Fri May 31 05:06:55 +0000 2024,BUKAN TUTUP MATA. disitu emang posisinya dari yg kita liat mereka lagi konsum pribadi dan brandnya ga keliatan sebenernya ini sama kayak sebagian dari kita yg masih pakai produk boikot semacam Unilever,Netral
Mon May 13 08:20:29 +0000 2024,gue dah lama boikot mcd &amp; produk unilever kalo sbux emg gapernah beli. tapi ada aja org TONE DEAF yg bangga ya ternyata. padahal cuma boikot loh? sesusah itu kah?,Netral
Wed Apr 24 13:44:37 +0000 2024,Bos Unilever Blak-blakan Dampak Aksi Boikot Produk Pro Israel di RI https://t.co/BkPpczJbZc,Netral
Fri May 31 11:09:09 +0000 2024,debat kecil sama bapak w masalah aku yg mau boikot Unilever blio memikirkan Unilever Indonesia karyawan dll gmn kalau diboikot produk ituu jg digunakan masyarakat kecil. mau dukung ituu ya caranya dengan berdoa dan donasi yaiya si bener.,Netral
Tue May 07 13:06:10 +0000 2024,selamat malam semua semoga tidur nyenyak&amp;nyaman kecuali yg ga boikot unilever group mnding bbo di goa ajh,Netral
Tue Apr 23 13:35:11 +0000 2024,muka gua sembuh dari bo gara gara fw simple terus karena unilever di boikot gua jadi bingung mau pake fw apa huffttt,Netral
Fri May 31 03:20:44 +0000 2024,ini asli ak udh ngetik panjang lebar loh UNFOLL ITU PILIHAN KALIAN GAUSA NGAJAK2 MEREKA GA SAMPE JADI BA ANJIR CUMA KONSUMSI PRIBADI SAMA KAYA KALIAN YANG GATAU UNILEVER TU BOIKOT AH.,Netral
Thu Apr 25 14:47:52 +0000 2024,Gua tetep boikot elu @Unilever sampai israel berhenti nembakin rakyat palestina,Netral
Tue Apr 23 10:26:19 +0000 2024,Emang udah paling bener boikot Unilever.,Netral
Mon Jun 03 02:59:13 +0000 2024,kalau bapakku kontra nya krna yg kita boikot Unilever dan yg ada di indo yg sekitanya kita pake produk itu sehari2 kalau yg McD Starbucks dll nya itu baru blio bilang nah ituuu yg wajib diboikot kalau Unilever Indo iya blio mikirin pekerjanya,Netral
Thu May 30 07:49:34 +0000 2024,Heran bgt boikot boikot tp buktinya unilever masih lancar jaya.. mcd masih aman sentosa.. sbux masih laris manis Minimal sih show with actions jg gacuma jago orasi ajaaaaa Maaf ya gengs I'm simply boycotting by not buying their products maaf gabisa ikut orasi,Netral
Sat Mar 16 23:02:07 +0000 2024,https://t.co/4wNrxbrHYX YKMI Sebut 10 Produk Terafiliasi Israel yang Masuk Daftar Boikot Mulai Ramadhan 2024: Starbucks Danone Nestle Zara Kraft Heinz Unilever Coca Cola Group McDonalds Mondelez Burger King dan Kurma Israel,Netral
Fri May 31 03:15:37 +0000 2024,ak tanya kalian tau ga produk unilever itu masuk list boikot? masi pada pake ga? coba cek gih bedanya kita bukan artis makanya gada yg komplen jadi sabar dulu ye ANJIR,Netral
Mon Apr 08 23:05:12 +0000 2024,Dulu emang aku sering denger tentang isu boikot unilever fast food mcd kfc gitu2 tp gak semassive sekarang. Alhamdulillah sekarang udah orang2 paham,Netral
Sun May 19 15:04:31 +0000 2024,Kalau mayora agak2 maju mundur kena soalnya dia kan perusahaan go publik ya susah ngontrol saham yg masuk jadi aku masih ga terlalu boikot Kalau unilever emg terang2an si support israel Kalau Google ini agak sulit dihindari kek aplikasi lain aplikasi aku jadiin tmpt speak up,Netral
Mon Apr 08 22:40:17 +0000 2024,buset voucher diskonnya unilever semua ya sasaran boikot ni gencar sekali marketingnya,Netral
Sun Mar 03 22:16:06 +0000 2024,Intip Prospek #Unilever (#UNVR) Saat Boikot Berlanjut | #shorts https://t.co/r6AMmQR9jW,Netral
Thu May 30 11:36:40 +0000 2024,Ini sejak unilever di boikot. Wings jor joran bgt promonya.,Netral
Wed Mar 06 12:03:46 +0000 2024,Alhamdulillah untuk big 3 dan american resto yg ngedukung isriwil kek phd domino burgerking unilever masih lanjut boikot,Netral
Thu May 02 14:47:43 +0000 2024,Boikot e wes ga usum ta? Ga menyalahkan tzuyu krna dia first love ku tp ini produk unilever loh,Netral
Fri May 31 12:47:44 +0000 2024,unilever masuk dalam list boikot gak ya? yang tau please rep,Netral
Wed Mar 06 09:15:21 +0000 2024,meski stres tak berkurang tapi hidup tetap berjalan dengan boikot sbx disney mcd loreal unilever bk....,Netral
Thu Apr 25 05:17:56 +0000 2024,Pernyataan Lengkap Bos Unilever soal Dampak Boikot Produk Israel di RI https://t.co/VLk9yyqvu1,Netral
Wed Apr 24 23:33:36 +0000 2024,Unilever Indonesia mengatakan penjualan produk perusahaan hingga Maret tahun ini sudah menunjukkan tanda perbaikan. https://t.co/zjArahPw86,Netral
Sun Mar 31 04:22:27 +0000 2024,Belom bisa boikot unilever sepenuhnya karena detergent rinso matic front load 5L jatohnya lebih murah dibanding merk lain dengan volume sama,Netral
Fri Apr 12 04:14:03 +0000 2024,Alhamdulillah aku bersyukur masih bisa boikot produk zionis kek macem mcf kfc danone unilever,Netral
Thu May 30 16:46:47 +0000 2024,Lah jelas berbeda semua kok. Ada yang boikot sbuck ada yang boikot Unilever ada yang ikut BDS list tok...not focused,Netral
Mon Jun 10 01:20:35 +0000 2024,Kelakuan Warga Sipil Zionis Israel Menghalangi Masuknya Bantuan Makanan Obat2 dll ke Gaza Rafah yg Sdh 7 bln Diblokade tanpa Listrik Air BBM Pasokan Makanan &amp; Obat2an. Terus Di Bom Maka Kita TERUSKAN BOIKOT Produk Pro Israel. McD KFC Unilever dll https://t.co/eXLSH9O4Xe,Netral
Sun May 05 23:30:07 +0000 2024,Geger Aksi Boikot! KFC sudah Tumbang di Malaysia Begini Kabar McDonald's dan Unilever https://t.co/4tsHanxj2V,Netral
Sat Feb 24 09:53:25 +0000 2024,gimana ya tanggapan pendukung genap yg pasang emoji semangka or bendera Palestine trus boikot mcd sbux unilever dll pas liat foto ini,Netral
Thu Apr 18 09:02:10 +0000 2024,Boikot dan Ganjalan Kinerja Unilever (UNVR) 2024 https://t.co/yEd0AFA0JZ,Netral
Tue Feb 13 05:28:36 +0000 2024,Terdampak Boikot Penjualan Unilever Indonesia Turun pada 2023 https://t.co/4fSdrtwJXm,Netral
Sat Apr 20 13:06:56 +0000 2024,Nestle Unilever punya Israel produk produk Unilever mesti di boikot woy tapi masih aja dibeli ama rakyat Indonesia ini perusahaan Israel 7 turunan nggak habis habis kali harta Israel hampir seluruh dunia dikuasi oleh mereka. Unilever tuh produknya banyak banget lagi.,Netral
Tue Apr 30 08:03:27 +0000 2024,PT Unilever Indonesia Tbk (UNVR) buka suara soal dampak boikot akibat konflik di timur tengah terhadap kinerja perseroannya. https://t.co/nujT5Zayh6,Netral
Thu May 30 02:33:08 +0000 2024,@szupremacy Sejauh ini kpopers cuma boikot yang jadi BA/collab belakangan ini aja gatau kekmana cara pandangnya. Kalo gua sistemnya boikot agensinya sekalian. Ibarat lu boikot unilever emamg lu boikot produknya pilih pilih? Pasti semua yg dibawah naungan unilever kan?,Netral
Sun Apr 21 06:52:32 +0000 2024,Kurang2i aja mbanding2in kesalahan orang. Orang jelas salah ya ditegur jangan kemudian membandingkan dengan kasus lain. Orang kalau boikot McD tapi ga boikot unilever ya biarin aja puji dan apresiasi mereka bukan malah nyinyir kek gitu.,Netral
Tue Apr 02 22:44:06 +0000 2024,org pd fafifufefo boikot produk kek sb unilever mcd dll tapi pelamar kerja di perusahaan tsb masih bnyk aja jir terutama unilever. gw kira pendaftar ulip bakal turun gara2 aksi boikot ,Netral
Sat Mar 30 19:05:22 +0000 2024,Unilever ni boikot ke,Netral
Sat Mar 16 06:03:58 +0000 2024,wallahi tantangan buat boikot produk unilever tuh berat bgt tapi demi palestina aku bakal bertahan,Netral
Sun Jun 09 05:57:14 +0000 2024,Yahudi Pesek.... Ga Malukah Kalian...??? Ini di New Yorl City orang boikot makanan pro israel dan Rela Antri Makanan Halal sbg Produk Pengganti. Masyaa Allah....Luar Biasa. Sadarlah Bangsaku Saudaraku. Lanjutkan Boikot Produk Pro Israel: Starbuck McD KFC Unilever dll,Netral
Fri Apr 05 20:35:57 +0000 2024,Pembahasan saur sama nyokap kali ini agak berat dikit lebih berat daripada ditanyain kapan nikah Jadi dapet hampers berupa bahan pangan tapi gak ada produk unilever (gw sih gak vokal boikot karena sadar masih standar ganda ) agak berat ngejelasin ke nyokap ,Netral
Tue Mar 26 09:46:00 +0000 2024,Sedangkan prio 4-6 itu di luar target utama tapi sangat diencourage utk itu diboikot misalnya kayak kita boikot Unilever atau L'oreal. Jadi udah jelas kalau untuk boikot hybe ini targeted di prioritas 1-3 sedangkan prio 4-6 itu opsional tapi tetap diencourage.,Netral
Wed May 29 03:32:12 +0000 2024,For me klu x boleh nak boikot barang2 personal care like J&amp;J / Unilever / P&amp;G aku boleh faham lagi. Tapi bab fast foods especially MCD &amp; STARBUCKS if orang still x boleh nak boikot memang makes my blood boiling. COME ON! THERE ARE LOTS OF OTHER OPTIONS!,Netral
Wed May 01 15:07:17 +0000 2024,Produk Unilever tolong boikot setiap aspek kehidupan iklan iklan di tv rata rata produk Unilever semua anjay,Netral
Wed Jun 12 18:13:16 +0000 2024,aku udah suka bgt sama C*tr* body serum complete glow itu wanginya soft enak deh pokoknya encer jadi cepet meresap. nyaman bgt pokok di pake habis mandi atau pas mau tidur. tapi karena produk Unilever jadi masuk list boikot .,Positif
Fri Feb 16 09:00:16 +0000 2024,@doolanolan Ga masuk BDS sih tp emak-emak sini banyak yg boikot Unilever WKWKWK Sunli banget gatuh ,Netral
Thu Mar 07 04:31:42 +0000 2024,Produk Wings itu emang lebih murah dari Unilever ya. Thanks to boikot. Jadi lebih hemat ,Netral
Sat Jun 01 04:32:24 +0000 2024,Yg teriak2 boikot apakah kalau dikasih offering 2 digit di Nestle atau Unilever akan ditolak juga?,Netral
Fri Apr 26 09:05:42 +0000 2024,Klo isu boikot Starbucks ga menarik buat gw. Warkop selain starbuck jg banyak. Dr yg jujur ampe lebih bandit dr Starbuck jg ada.. Menarik itu bahas boikot unilever..,Netral
Thu Apr 25 04:42:39 +0000 2024,Bos Unilever Ungkap Dampak Aksi Boikot Produk Pro Israel di Indonesia https://t.co/bDgTCowFWR,Netral
Sat Mar 30 07:16:20 +0000 2024,nanti klo sampe aku nemu akun yg pro boikot HOTS tp masih pake produk unilever mw aku toyor jidatna,Netral
Wed Apr 24 09:37:49 +0000 2024,@_mardial_ Dari belasan tahun lalu issue boikot produk Israel (Unilever nestle dll) udah ada dan belum booming ky sekarang ulama Saudi dan turunannya salah satu yg banyak kasih fatwa kl boikot itu pilihan personal dan tetap boleh konsumsi barang itu skrg aja byk yg maksa utk boikot,Netral
Fri May 31 11:24:50 +0000 2024,produk lion wings sama tempo masuk boikot kah? tadi scan di no thanks kodomo kok katanya punya unilever padahal aku cari tau dia punya lion wings. kasih pencerahan tolong hiks,Netral
Wed Apr 24 00:59:41 +0000 2024,@madTarada @CNNIndonesia masih konsisten boikot unilever hahha,Netral
Thu Apr 25 02:01:34 +0000 2024,Strategi Unilever Hadapi Dampak Boikot dan Pelemahan Harga Saham https://t.co/YoJPxnDuIE,Netral
Sat May 04 01:27:56 +0000 2024,@worksfess produk unilever kita boikot kerja di unilever kita sikat ,Netral
Tue Mar 19 09:16:10 +0000 2024,Banyak yg boikot unilever tapi hari ini gue bazaar di unilever hampir 75% yg kerja berhijab semua dan panjang bgt hijabnya.,Netral
Fri Apr 12 09:10:42 +0000 2024,y'all don't even know what's on the BDS list. stop canceling celebs consuming sbux and mcd. u guys still use unilever sbux ama mcd di bds cokkk!! NGERTI GAK SE COK??? GAKPOPO KON BOIKOT UNILEVER TAPI GAK KABEH WONG ISOK BOIKOT UNILEVER. NEK SBUX+MCD KABEH WONG ISOK BOIKOT COKKK,Netral
Fri May 03 06:31:13 +0000 2024,@starfess bentar deh ponds nih bukannya produk unilever yaa ? Unilever di boikot kan? Kok pada gaada yg komen teriak² soal boikot ? apa saat ini boikot cm hanya untuk brand starbucks mcd gitu² doang kah ?,Netral
Thu Jun 13 11:15:35 +0000 2024,@alvR_001 @WatchmenID aku ttp nonton sih udh di nanti² soalny utk boikot aku ikut jg kek baned Starbucks KFC Unilever McD utk film aku ndk soalnya yg blg ban Dsny TPI mlh nntn Netflix pdhl merka sama ae :),Netral
Sat Jun 15 22:57:15 +0000 2024,@erlanishere Jangan lupa boikot produk Unilever Aqua dan Mcd,Netral
Tue Jun 04 22:25:56 +0000 2024,@alyaial @convomf berarti kl ga boikot oreo &amp; produk unilever gapapa kan kl ikutnya boikot sistem BDS? soalnya sejak ada isu2 boikot ini aku stop beli oreo stop beli produk unilever &amp; banyak produk yg di tiap postingan produk itu disuru nyari alter. jujur aja aku boikot semua krn takut dicerca,Netral
Fri Apr 12 03:06:00 +0000 2024,@gus_muslih @ustadzsyafiq @gus_muslim Alah bilang aja kalian temenan. Biar punya nilai tawar duit. Misalnya aksi 212 biar orang kalian naik jadi Rl2 : Maruf Amin.. Misalnya boikot unilever skrng jadi sponsor kegiatan kalian.. Drama isu2 wahabi padahal kalian kompak di belakang:)) bukti : GAK MAU LAPOR,Netral
Sat May 11 12:03:38 +0000 2024,krna oreo boikot aku iseng ganti monde buat topping eh kok cantik?? https://t.co/lpw5alX0NU,Netral
Tue Apr 30 03:39:50 +0000 2024,*Apakah kalian tidak jijik masih mau konsumsi OREO?* *udh HARAM mengandung BABI gambarnya lambang² dajjal semua produk Israhell ditambah lagi banyak kutu busuknya * *Jangan ragu untuk BOIKOT.!!!* https://t.co/kVqQ5ONov1,Netral
