created_at,full_text,Sentimen
Mon Jun 03 13:09:06 +0000 2024,so far brand yg udah secara konsisten gw boikot dan semoga selalu konsisten: - nestle - starbucks - pizza hut - kfc - mcd - burger king masih akan terus pelan pelan boikot yg possible buat diboikot,Netral
Thu May 02 07:15:00 +0000 2024,Ramai-Ramai McD Pizza Hut Starbucks Lapor Bisnis Turun Dampak Boikot? https://t.co/1YWXX8AOke,Netral
Sat Apr 06 23:48:40 +0000 2024,Baru sekarang tau Ayamas dah tutup... KENAPA LA TIME BOIKOT KEPCI PIZZA HUT PRO ZIYONIS DIA PERGI TUTUP??? HAMPAGAS BETUL LA MASA MCM NI LA PATUT FOKUS JENAMA LOKAL BONGOK TAK HABIS2 BETUL LA EEEIII ‍️‍️,Netral
Fri Jan 19 20:53:16 +0000 2024,Sudah pasti boikot Pizza Hut,Netral
Fri May 10 08:47:37 +0000 2024,ini keluhan gue dr sblm jaman boikot... kenapa dominos... ama pizza hut... menunya banyak bgt... pdhl mereka bisa bikin 1 menu per size trus kita disuruh centang varian topping sama crust... apa gue aja yg jadi ceonya... biar langsung dukung palestine juga...,Netral
Tue May 28 08:18:02 +0000 2024,pizza hut tuh produk boikot kan?,Netral
Thu Jun 13 07:12:37 +0000 2024,Teruskan boikot KFC dan Pizza Hut.,Netral
Thu May 30 12:01:29 +0000 2024,Ada yang tau ga ya pengganti pizza hut apa.... soalnya kdg pengen banget pizza cuma dua-duanya boikot ,Netral
Tue May 28 08:19:33 +0000 2024,domino sama pizza hut kan lg boikot ya terus beli apa yaa lagi bm banget pizza :),Netral
Tue Jan 30 21:01:37 +0000 2024,Dahsyatnya Solidaritas Pro Palestina Boikot Produk Pro Israel KFC Pizza Hut Krispy Kreme dan Hardee's Mulai Terdampak https://t.co/M9RsnApsJf,Netral
Thu May 02 10:41:52 +0000 2024,Pizza hut itu sudah bertahun2 selalu merugi sebelum boikot Makanya dulu sebelum pandemi pun mereka sampe jualan pizza dipinggir jalan pake motor Lu pikir itu karena apa?? Kalo mau hasbara mbok ya jangan tolol tolol,Netral
Thu May 09 15:52:44 +0000 2024,di keluargaku kalo ngerayain sesuatu selalu ke pizza hut semenjak boikot mama belajar bikin pizza sendiri (dan enak btw). kalo ponakan ke rumah biasanya dibeliin mcd atau burger king semenjak boikot mama rajin masak buat mereka. boycott is easy if you want to.,Netral
Wed Jun 05 03:58:33 +0000 2024,Boikot itu tidak membeli produk Pizza Hut bukan memaki-maki pegawai Pizza Hut tidak bersalah yang berusaha mengais rezeki di tengah-tengah lapangan kerja yang karut-marut,Netral
Tue Apr 23 11:20:35 +0000 2024,Kerugian Pengelola Pizza Hut (PZZA) Semakin Dalam Akibat Boikot https://t.co/InUe2ZQHuP,Netral
Tue Apr 02 21:29:07 +0000 2024,Sebenernya dulu mekidi keepsi pizza hut tu udh ada gerakan buat di boikot sekitar taun 2014(?) an lupa Cma gatau kenapa seiring berjalannya waktu org org ramein mekidi pizza hut dkk lagi Trs pas ada berita genosida di Palestina ini akhirnya org org nge boikot lagi,Netral
Sat Jun 15 05:57:51 +0000 2024,pizza hut boikot ga sih?,Netral
Thu Jan 18 22:35:59 +0000 2024,Tetap boikot mcd Pizza hut ,Netral
Sun May 05 03:26:17 +0000 2024,Ada temen boikot Pizza Hut tapi makan marugame udon.,Netral
Wed Mar 06 14:12:14 +0000 2024,gue pribadi kesulitan boikot pizza hut. seumur hidup gapernah intentionally beli pizza selain brand ini. paling susah kuboikot krn seumur hidup cm makan super supreme tenang aja udah ga gue beli kok in the past few months,Netral
Wed Jun 05 08:41:52 +0000 2024,Gw gak setuju yg kyk gini. Kasir pizza hut itu cuma kerja bisa aja mrka cuma bisa kerja di situ kalian boikot cukup tak usah beli gak usah maki-maki pekerjanya. Boikot kok malah nginjek2 sesama pekerja buruh ,Netral
Thu Mar 14 09:22:59 +0000 2024,Mau tanya Pizza hut termasuk ke dalam list boikot kah?,Netral
Fri Mar 15 12:19:04 +0000 2024,pizza hut boikot jg kah kirain domino doang,Netral
Sun Feb 25 12:34:02 +0000 2024,Since Pizza Hut &amp; Domino boikot en pizza dekat mana lagi yg best ye?,Netral
Thu Feb 01 12:02:40 +0000 2024,Lama gile x makan pizza lepas pizza hut and Domino's masuk dalam list boikot. Ok pizza apa yang tak support israel?,Netral
Mon Jan 22 04:14:21 +0000 2024,banyak beli barang yg di boikot 'pizza hut &amp; mcd' tapi kesalahan itu ada karena bliau mengonsumsi nya di ruang public. jujur mcd dan sbux di daerah gua masih rame. GUA KECEWA BERATT terserah lu minum itu di dorm atau kamar hotel lu TAPI SETIDAKNYA RESPECT DENGAN GA MINUM DI PUBL,Netral
Sat Jan 20 02:54:40 +0000 2024,pizza hut bukan memang boikot ke? okay boikot and support local pizza,Netral
Sun Jun 02 06:20:23 +0000 2024,Domino atau Pizza Hut list boikot tak?,Netral
Sat Apr 13 06:53:59 +0000 2024,dah excited mau mam pizza tp br keinget KITA KAN BOIKOT PIZZA HUT YA.........,Netral
Sat May 04 02:17:30 +0000 2024,Efek boikot itu ril lho. Pizza Hut kemarin ngumumin kalo mereka rugi 96M sepanjang 2023 kmrn. Krn kondisi ekonomi juga + efek boikot kata mereka. Jadi teruslah kita boikot. Yg paling gampang yg fast food2 lah sm kopi. Pilihan penggantinya buanyak bgt kok.,Netral
Thu Apr 25 04:37:39 +0000 2024,PZZA (Pizza Hut PT Sarimelati Kencana) melaporkan kerugian th buku 2023: Rp96.2 miliar. Lanjutkan boikot karena pizza GL lbh enak.,Netral
Wed Feb 21 06:25:34 +0000 2024,That's why di antara target2 boikot paling benci sama mekdi &amp; pizza hut ,Netral
Wed Jan 31 05:48:27 +0000 2024,Dampak Boikot Israel KFC hingga Pizza Hut Mulai PHK Karyawan https://t.co/5Ayn7FanQv,Netral
Thu Mar 07 00:46:46 +0000 2024,Tak pernah cakap redha pun actually dengan perbuatan kartel main harga. Tapi tengoklah baik-baik. Yang bekerja di bakers cottage tu pun ramai anak-anak muda melayu islam juga. Kalau bakers cottage pun nak boikot juga sama dengan kfc mcd pizza hut starbucks ,Netral
Wed Apr 10 14:51:34 +0000 2024,Kalau kita tak boikot pizza hut tadi dinner tu pakcik dah makn personal box rm 5 dah .,Netral
Thu May 02 14:27:50 +0000 2024,udah ga pernah ke pizza hut selain boikot juga karena ada pizza marzano ,Netral
Tue May 21 10:07:27 +0000 2024,Anak requested pizza. Pening kepala domino pizza hut kan boikot. Doa seorang mak ni Allah angkat pusing pusing area rumah jumpa small stall jual Pizza. Alhamdulillah happy anak makan. Terima kasih Allah ,Netral
Wed Feb 14 14:13:51 +0000 2024,ampe skrng ad yg masiii boycoting kgaak?? plis muncul yg masiii kgaak beli produk yg di boikot mcd kfc pizza hut dkk kerabat deket gw dah mulai bodoamat sedih wehh ,Netral
Wed May 29 23:26:55 +0000 2024,Pengen pizza hut tapi lagi boikot!! ,Netral
Wed Jan 24 15:41:55 +0000 2024,Kalau cuma boikot Starbucks McD Pizza HUT KFC mah gampang. Kalau disuruh boikot warteg bahari pecel Blitar dan nasi Padang naah ini yang susah,Netral
Thu Apr 11 16:33:51 +0000 2024,@YandraD31 Tetap konsisten boikot pizza HUT dan produk produk yg mendukung israhell lainnya,Netral
Sat Jun 15 10:32:13 +0000 2024,Karena masih Boikot produk Pizza hut sekarang kalian kalau mau beli Pizza kemana guys? Coba drop rekomendasi kalian!,Netral
Tue Jan 30 07:03:13 +0000 2024,Dampak Boikot Israel KFC dan Pizza Hut PHK Karyawan https://t.co/qADpaAcQQg via @nawacit4,Netral
Wed Jan 31 05:33:43 +0000 2024,Dampak Boikot Israel KFC hingga Pizza Hut Mulai PHK Karyawan https://t.co/yROx8XJxDe,Netral
Wed Jan 31 12:06:00 +0000 2024,Dampak Boikot Israel KFC hingga Pizza Hut Mulai PHK Karyawan https://t.co/6pRJ0Sqd7S,Netral
Wed Jan 31 09:53:40 +0000 2024,Pizza Limo harusnya ehh tapi pro Israel deng Pizza Hut mah. Boikot aja :))),Netral
Fri Feb 02 11:45:55 +0000 2024,Semenjak Pizza Hut dengan Dominos kena boikot dah hampir 4 bulan mengidam nak makan Pizza. Today my beautiful wife made me pizza. Not one but 3. She really can cook anything. Terharu betul. Tak sia-sia bayar hantaran RM22 000. ,Netral
Tue Apr 30 02:46:17 +0000 2024,Terhantam Boikot Pizza Hut Rugi Rp58 6 M di Kuartal-I 2024 https://t.co/OLZnPUYJaR,Netral
Mon Apr 01 00:54:23 +0000 2024,Semenjak kena boikot Pizza Hut ni dah lama tak makan pizza ,Netral
Fri Jun 14 09:23:17 +0000 2024,Jujur engga sih. Belum ada yang bisa kalahin rasa-rasa makanan yang diboikot kayak mcd kfc dan pizza hut tapi gapapa namanya boikot kan tergantung hati nurani. Kalau mau menghibur diri dengan mencari makanan yang mirip-mirip rasanya juga gapapa.,Netral
Thu May 02 15:09:31 +0000 2024,Pizza Hut PhD rugi bukan karena boikot mungkin simply udah gak enak gak ada pembaruan menu yg signifikan dan pizza pesaingnya lebih enak. Roti tebel saos biasa topping kek sosis curah harga mahal. Sama-sama habis 100rebu mending marzano ,Netral
Tue Apr 02 14:31:40 +0000 2024,Temen kantor yg dulu sok sok boikot kemarin ultah beli Pizza Hut limousine buat sekantor. Udah pinter dia sadar kalo boikot itu gerakan gak jelas yg merugikan bangsa kita sendiri. Capek boikat boikot tapi pelurunya Israel gak habis2.,Netral
Wed Apr 10 02:02:40 +0000 2024,Tbh gara2 mslh boikat boikot gw nemu resto lokal yg lbh enak di luar mcd kyk pizza hut misal gw ga bakal balik pizza hut soalnya nemu resto itali otentik dan murah ,Netral
Sat Mar 09 10:48:42 +0000 2024,Pizza hut nih produk boikot apa engga sih soalnya aku mau pizza hut bgt,Netral
Fri Mar 15 11:00:55 +0000 2024,@GerakanBDS_ID Rekomen pizza yg enak dong... Pizza hut sama domino di boikot soalnya ,Netral
Thu May 02 03:03:53 +0000 2024,Akibat Boikot Penjualan Induk Pizza Hut &amp; KFC Merosot 3% https://t.co/f8S6UaLERu,Netral
Mon Apr 01 02:58:01 +0000 2024,Terhantam Boikot Israel Rugi Emiten Pizza Hut (PZZA) Bengkak 310 23% https://t.co/e0j0u8MyOF,Netral
Sat Mar 23 23:42:04 +0000 2024,Aku boikot Starbuck McD Pizza Hut etc. Kalau orang lain beli pastu dia bagi aku aku tolak.,Netral
Tue May 28 01:15:50 +0000 2024,letak pizza hut patut kena boikot tapi kfc tak tpi seingat aku wktu aku kerja kfc dulu dulu lah pizza hut punya management dgn kfc sama sekarang tak tau.,Netral
Fri Apr 12 06:40:30 +0000 2024,Yang nyebarin narasi ini tuh media² israel sama KOL² mereka. Lalu kalian telan mentah² trus disebarin ke followers entah demi apa. Sama pizza hut aja boikot kok sama media² yang jelas² media israel percaya mentah²,Netral
Tue Jan 30 07:03:25 +0000 2024,Dampak Boikot Israel KFC dan Pizza Hut PHK Karyawan https://t.co/JP9IGHh3M9 via @nawacit4,Netral
Fri May 03 04:02:36 +0000 2024,@yonatanugerah @TNama70377 @LoudMinorities @RnaReii @onedayoneilm hipokrit itu kalau rame bersuara di sosmed boikot pizza hut tapi ternyata di real life tetep makan pizza hut ,Netral
Mon Jan 22 16:21:01 +0000 2024,aneh kalo mau boikot ya boikot pizza hut israel dikira management ph tiap negara ngelakuin yg sama entah makin lama makin ilfeel sama yg boikot2 gini X yg jelas2 dukung israel aja (di palestina X kudu pake vpn karna udah block) dan X masih lu pake...,Netral
Thu Apr 11 11:50:10 +0000 2024,@ub_mfs Iya emang gak ada. Krn orang Malang asli pasti akan boikot pizza hut.,Netral
Tue Jan 30 07:03:39 +0000 2024,Dampak Boikot Israel KFC dan Pizza Hut PHK Karyawan https://t.co/T4MNW2L4VI via @nawacit4,Netral
Fri Mar 15 12:29:50 +0000 2024,@gatligngun aku malah lebih tau boikot pizza hut dulu daripada domino : ),Netral
Sat Mar 09 11:50:52 +0000 2024,@qinkqonk @FOODFESS2 Di deket gw adanya Go-Pizza Bang 100% lokal udh beli bbrp bulan lalu pas rame boikot Pizza Hut &amp; Domino's. Skrg blm kepengen pizza tp kalo lg ada rezekinya nanti beli yg lokal-lokal aja Kalo yg ngerusak hidup keluarga di belahan bumi lain gak dlu dh mkasi ,Netral
Thu Mar 28 00:07:18 +0000 2024,Target boikot lainnya (BDS): Domino s Pizza Burger King Pizza Hut McDonald 4 brand ini memiliki keterkaitan investasi dengan Israel yang secara langsung berdampak pada usaha genosida yang terjadi di Gaza.,Netral
Mon May 20 02:50:26 +0000 2024,Bismillah Ustadzah Oki Setiana Dewi &amp; Nestle Produk yg terafiliasi dgn Zionis Israel !! Video 1 : saat dia Mengajak agar Boikot Produk Zionis Israel &amp; Mengajak Kita agar Mencintai Produk Indonesia. Foto 2 : Lain di Mulut Lain di Hati sehingga menjadi munafik &amp; menjijikan‼️ https://t.co/SAFbX5zzzX,Netral
Thu Feb 15 19:05:20 +0000 2024,Boikot la selagi boleh boikot.. Produk nestle ..or anything.. Doa untuk #Rafah #Palestine Jom la penuhkan Masjid Subuh sama2.. 🇵🇸 https://t.co/mQKqP7QYNr,Netral
Sun May 05 14:45:25 +0000 2024,Issue boikot ni sebenarnya hal individu terpulang la nak boikot or tak ! Takperlu la mcm kau terpaling boikot divided kwsp kau pun dr sumber nestle ye. Tak perlu nak mengelabah tak tentu hala la lagi pun my previous picture from may 2022. https://t.co/pCgp1FDoMx,Netral
Thu Feb 08 09:58:59 +0000 2024,Self reward kunun sbb anak2 tak ikut Kite sapot aiskrim lokal sbb boikot Walls &amp; Nestle https://t.co/7891siZTzx,Netral
Fri May 31 08:52:20 +0000 2024,@perogeremmer bener sih tp skrg udh ganti ke indocafe karena lagi ikut boikot nestle https://t.co/LlTYYw8Bdg,Netral
Sat Dec 16 12:29:17 +0000 2023,Sejak kena boikot Nestle cuba try brand Lotus sedap jugak yg penting tak cepat lembik. Murah pun murah https://t.co/aXrvmrs3KA,Netral
Thu Mar 07 12:38:39 +0000 2024,Boikot kalini membuktikan yang kita boleh je hidup tanpa Starbucks Mcdonalds Krispy Kreme Nestle dan KFC ni. Banyak je local brands yang kita boleh guna selain brands yang openly supporting Israel. This is our fight altogether so kau taknak boikot? That s on you. https://t.co/Ys3kPXrGbc,Netral
Sun Mar 10 07:51:55 +0000 2024,Nestle takyah boikot ke? https://t.co/TqRUx5CYpl,Netral
Sat Jun 01 02:28:37 +0000 2024,Kalo emang sadar akan isu kemanusiaan boikot Nestle walaupun gak jadi list utama BDS asal kalian baca berita pasti tau DOSA NESTLE TUH BANYAK ,Netral
Sun Apr 28 13:44:22 +0000 2024,Naik harga atau turun harga BOIKOT produk Nestle tetap diteruskan ,Netral
Sun Dec 31 09:22:14 +0000 2023,Boikot nestle gais ,Netral
Mon Apr 22 10:20:14 +0000 2024,Boikot @Nestle,Netral
Thu Apr 18 08:18:17 +0000 2024,Taknak boikot nestle sebab palestin pun boikot sebab ni,Netral
Thu Jun 06 01:07:32 +0000 2024,Saya pergi kebanyakan Mamak tukar produk. Maggi ke Indomie Numee Cintan. Milo ke Myvic. Nescafe ke Indocafe. Tapi ada kedai melayu yang tak ada kesedaran boikot produk Nestle.,Netral
Wed May 29 10:48:50 +0000 2024,semua sudah aku boikot kecuali nestle duh netsle mineral paling comfort ..tapi aku akan berusaha ok .BTW BOIKOT AQUA JG PLS,Netral
Sat May 18 07:59:30 +0000 2024,Boleh. Tujuan asal boikot untuk bagi pressure. dan berjaya. ZUS cakap adidas one time event je. ZUS bkn penyumbang kepada israel. pasal nestle tu aku rasa supplier lama kot sebab haritu nampak orang tweet ZUS pakai susu farm fresh. so jawapan dia boleh je continue sapot ZUS,Netral
Fri Jun 14 03:00:16 +0000 2024,Dah tak mahu boikot ke? Nestle itu jenama yg sokong penindasan israel terhadap rakyat Palestin &amp; umat islam https://t.co/jOesDdUALG,Netral
Sat May 18 02:56:30 +0000 2024,Orang minta boikot je tu je la benda paling mudah. Tak mampu sudah Kalau Al-Ikhsan jual barang boikot jangan beli jenama yang diboikot. Kalau mall ada jual barang nestle l jangan beli nestle. Kalau nak boikot satu mall suka hang la extra pahala jihad for you ,Positif
Sun Apr 14 05:54:37 +0000 2024,Aku rasa sbb conflakes sedap drpd NESTLE (boikot israel) kellogs (boikot usa) pun rasanya kurg sedap compared to nestle tu beli conflakes bundle lagi lah hampeh rasanya cornflakes bakery shops asyik habis.. last2 tak buat/tak hidang ke tetamu..,Netral
Fri Feb 02 00:45:28 +0000 2024,tah tah yang cakap tu pun pakai maybelline/loreal pastu guna nestle apa bagai kat rumah terpaling boikot sampai jadi bodo tak beradab,Netral
Fri Jun 14 02:14:36 +0000 2024,Kantoi busuk je @_JANGAN_DIAM x boikot Nestle. Kahkahkah bodoh piang https://t.co/SpJVOx3V0z,Netral
Thu Apr 18 05:07:11 +0000 2024,Ini baru alasan yg valid untuk boikot Nestle,Netral
Mon Apr 29 23:36:37 +0000 2024,Bukan nak mengajar///:Xfhm apa kena boikot .Nestle !!!,Netral
Thu Feb 22 05:21:20 +0000 2024,air yg paling enak emg nestle sih tp barang boikot dan mas bembeng gk dagang nestle,Netral
Thu Apr 18 09:58:28 +0000 2024,nggak ada dosa sama sekali kalo kamu boikot nestle. kamu cuma menjaga kesehatan keluargamu. itu aja.,Netral
Tue Feb 13 01:08:05 +0000 2024,@devi_amani Itu artikel ditulis bulan November 2023 sekarang sudah gak ada nestle di daftar boikot oleh BDS Movement. https://t.co/VpkZU3WW7a,Netral
Tue Mar 12 11:11:16 +0000 2024,Dia guna produk nestle. Boikot!,Netral
Sun Apr 07 07:26:30 +0000 2024,Salam dari bubble lebai hitam aloq staq. Ya. Harga barang turun. Aku pun hairan sebab aku jangka naik sebab nak dekat raya. Tak termasuk harga promosi. Harga promosi ada 2 jenis: 1. Promosi sebab nak raya 2. Promosi sebab kena boikot. Cth produk nestle sabun sunlight.,Netral
Mon Apr 29 23:35:59 +0000 2024,Nestle Jenama kena boikot babi xfaham2 ada Nestle jgn mkn babiiii,Netral
Mon Apr 08 03:16:30 +0000 2024,Ngomongin air mineral yang kena boikot gue jadi keinget NESTLÉ PURELIFE. Tiba-tiba masif endorse influnecer tt gue ada follow influence ig yang kebetulan emg ngonten di tt and mannnnnn gue cem di tl emg tiba-tiba jadi banyak banget yang diendorese brand zionist itu.,Netral
Thu May 30 11:37:15 +0000 2024,Suruh boikot Nestle tapi aku setiap hari selalu butuh produk Nestle Bearbrand,Netral
Sat May 18 07:25:41 +0000 2024,Kan boikot nestle kan? Jual ah pegangan saham tu. Tapi tulah boikot ni hok kene lubang tekok mg je.,Netral
Fri May 24 06:02:49 +0000 2024,Terliur tengok pink lemonade nestle tapi kena boikot ,Netral
Fri Jun 14 17:29:53 +0000 2024,Bukan ke rakyat Malaysia boikot nestle?,Netral
Thu Mar 28 09:02:37 +0000 2024,saya ada soalan untuk pembuat kek batik. korang kalau nak buat pakai serbuk apa since milo dah boikot under nestle? i ada dengar campur beryls dengan vico tapi tachod tak jadii ,Netral
Sun May 05 09:25:21 +0000 2024,akunya boikot nestle tp nong bus malah jd BA nya huftt,Netral
Mon Jun 03 13:09:06 +0000 2024,so far brand yg udah secara konsisten gw boikot dan semoga selalu konsisten: - nestle - starbucks - pizza hut - kfc - mcd - burger king masih akan terus pelan pelan boikot yg possible buat diboikot,Netral
Sun Apr 21 04:04:06 +0000 2024,Ini memant celaka!! Boikot Nestle!,Netral
Thu Jan 04 13:12:52 +0000 2024,Pergi mkn MB yelah skrang kan McD boikot time order eh air coke tk nk lh order Fanta punya company Coke punya order Milo pun boikot order coffee Nestle juga sama air mineral je lh eh air mineral for your information syarikat coke punya. Aku rasa salah percaturan.,Netral
Thu Feb 22 08:44:03 +0000 2024,Bayangkan dah bersolidariti utk palestin sanggup tak makan mcd boikot produk nestle.. tapi baran pukul org sampai mati. Sama perangai je dengan israel kalau macam ni,Netral
Fri Feb 09 00:29:45 +0000 2024,Kempen boikot ekoran keganasan di Palestin sudah menjangkau empat bulan Rata-rata warga maya menggesa supaya kempen boikot diteruskan memandangkan genosid di Palestin masih berlaku. Untuk rekod produk Nestle di Malaysia turut menerima kesan boikot https://t.co/dhHAg7rO4o,Netral
Sun Apr 14 17:21:15 +0000 2024,Yang duk boikot tu kfc dengan mcd je ke? Barang-barang nestle boikot tak?,Netral
Sat May 18 02:28:16 +0000 2024,Entah apa yg susah sgt nak paham Zus tu standalone bisnes dia buat statement cmtu so org boikot brand dia mcm adidas nestle mcd tu. Al-Ikhsan aeon speedmart tu reseller jual banyak brand lain kalau HQ diorg yg buat benda sama kita boikot kedai dia.,Netral
Sat Mar 16 23:02:07 +0000 2024,https://t.co/4wNrxbrHYX YKMI Sebut 10 Produk Terafiliasi Israel yang Masuk Daftar Boikot Mulai Ramadhan 2024: Starbucks Danone Nestle Zara Kraft Heinz Unilever Coca Cola Group McDonalds Mondelez Burger King dan Kurma Israel,Netral
Sat Mar 23 11:51:44 +0000 2024,Payah gak nak boikot Nestle ni.,Netral
Sat May 18 05:05:54 +0000 2024,Cara kita boikot Al-Ikhsan ialah dengan tak beli kasut jenama adidas. Sama macam nestle dekat Speedmart. Kalau ZUS kolab dengan Adidas apa kaedah pembeli nak boikot? ZUS jual kasut Adidas dalam rak kek dia ke? Jadi boikotlah kopi ZUS. Duit dia sukahati dialah!,Positif
Fri Jan 19 10:36:05 +0000 2024,Jujur aku udah boikot produk yang pro zionis cuma aku gak bisa ganti air mineral kecuali nestle pure life dosa gak ya,Netral
Sun Apr 28 12:42:12 +0000 2024,naik ke turun ke tetap boikot nestle. https://t.co/DyOzooBe0j,Netral
Fri Jun 07 00:32:40 +0000 2024,Saya pergi kebanyakan kedai Melayu tukar produk. Tapi ada kedai Mamak yang tak ada kesedaran boikot produk Nestle. real story. saya mindlessly order megi goreng. tengah suap baru perasan kat rak dapur beratur mi Maggi.,Netral
Sat Jun 15 05:23:19 +0000 2024,Boikot jela Nestle ni,Netral
Tue Dec 26 09:40:22 +0000 2023,Aku boikot je 3 ni in exchange takleh nak boikot Nestle sangat. Fair enough la kan,Netral
Tue Jun 04 12:53:43 +0000 2024,Tadi beli camilan di Alfa***t bareng anak dan tayangan promo di belakang kasir ialah Bear Brand dengan BA: Nicholas Saputra. Nestle (Bear Brand) &amp; Danone (Aqua) itu masuk daftar boikot karena mendukung Israel. Promosi silakan. Boikot tetap jalan. https://t.co/rgwUYPjlbN,Netral
Fri Jun 14 01:28:59 +0000 2024,@_JANGAN_DIAM Nestle kena boikot sbb israhell.ada hati nak naik harga,Netral
Fri May 17 16:15:49 +0000 2024,Segelintir cuba justify kenapa Zus kena hentam dan diugut boikot tapi Al Ikhsan tidak. 1. Zus bukan in sportswear business Al Ikhsan is so acceptable untuk Al Ikhsan jual Adidas. 2. Zus collab with Adidas tak boleh. Al Ikhsan merely jual Adidas macam 99 Speedmart jual Nestle,Netral
Tue Apr 23 00:30:12 +0000 2024,Memang dari awal boikot Nestle boooooo,Netral
Fri Jun 14 02:29:44 +0000 2024,Bang kata macai PH produk Nestle kena boikot kan sebab sokong Israel bukan rakyat akan terasa pon,Netral
Thu Apr 18 08:05:42 +0000 2024,Sebab tu kita boikot nestle,Netral
Sat Apr 13 15:23:45 +0000 2024,Sbb orang boikot nestle ‍️,Netral
Fri Apr 19 15:35:30 +0000 2024,Saya dah mula boikot Nestle dengan berhenti beli aiskrim Nestle,Netral
Sun Jun 02 17:21:34 +0000 2024,Brand nya di Boikot !! Pertanyaan nya; gmn dgn public figur sbg BA nya ?? @agnezmo aja hanya minum setarbak udh di judge sbg zionis Nicholas Saputra BA Nestle X Enzy Storia https://t.co/Je3BkJb309,Netral
Fri Apr 19 06:18:57 +0000 2024,ternampak news tadi geram gila dengan nestle. tambah gula dekat makanan baby dekat negara miskin. undeclared pulak tu. memang patut kita boikot,Netral
Sun Apr 28 05:34:00 +0000 2024,I dah boikot aiskrim nestle coklat cadbury and kitkat tapi berat still tak turun lmao,Netral
Thu Feb 08 07:44:05 +0000 2024,Jualan produk Nestle di negara ini dilapor menjunam susulan boikot ke atas jenama makanan itu https://t.co/H0xkBqblQN,Netral
Thu Apr 18 10:25:15 +0000 2024,Teruskan boikot nestle! Jahat!,Netral
Fri Mar 29 02:14:46 +0000 2024,Tahu tak mana-mana nestum brand lain selain Nestum-Nestle? My mom super loooveee nestum tapi taknak lah beli yg Nestle punya. Boikot! ,Netral
Fri Jun 14 09:00:47 +0000 2024,@firasxy3 Kenapa un peduli nestle nk naikkan harga? Un tak boikot ka?,Netral
Fri Jun 14 05:19:17 +0000 2024,bukan boikot ke produk nestle ?? ni mesti israel nk pakai duit nk berperang dgn lubnan lak.,Netral
Sat Mar 02 04:22:57 +0000 2024,nestle boikot kan ya?,Netral
Tue Mar 05 03:46:02 +0000 2024,Mudah banget teriak utk boikot produk2 tertentu krn produk2 itu emang mahal utk sebagian kalangan. Beda kalo produk2nya murah meriah apalagi kebutuhan sehari-hari. Contoh: nestle unilever,Netral
Fri Jun 14 05:43:53 +0000 2024,@_JANGAN_DIAM Org boikot produk Nestle la. Support Zionis Israel.,Netral
Sat Feb 24 14:29:04 +0000 2024,@tanyakanrl Gue udh kurang percaya sm dia sejak masalah boikot nestle pure life dia bilang jng sampe gerakan boikot malah menzolimi orang2 yg bekerja disana yg gada hubungannya. Mana bandinginnya sama lays yg udh ganti merk jd chitato ya beda lah.,Netral
Thu Mar 28 04:54:16 +0000 2024,Kenapa ada orang yang boikot Nestle walaupun takde dalam list BDS ni? Adakah kerana buy malaysian first?,Netral
Fri May 17 02:11:09 +0000 2024,Teringat akak tempat kerja ni dia pakai baju sweater Nestlé sebab laki dia kerja situ. Pergi balik kerja naik motor je. Masa kat traffic lights kena maki beb dengan orang yang berenti situ. Masa tu baru² lagi isu boikot barang Nestlé. Sedih muka akak tu cerita esok ya ,Netral
Fri Apr 19 12:51:50 +0000 2024,Dah boleh boikot nestle permanently,Netral
Fri May 17 07:13:30 +0000 2024,THISSSSSS. Dalam industry f&amp;b sekarang ni boikot paling besar &amp; perlu ialah Nestle dan Pepsi Co. Sila google sub brands dorang ye.,Netral
Fri Jun 14 03:52:44 +0000 2024,@_JANGAN_DIAM Memang boikot Nestle. Naik lah berapa byk produk pun.,Netral
Sun May 12 09:32:03 +0000 2024,lah diknon mintak share je marah pulak. nestle from Swiss hq kat Vevey and bukan franchise. franchise tu macam sbux cafe. ada ke outlet nestle kat sini? google free dik kalau boikot jugak boleh pakai Opera @BDSmovement follow and study kat sini yg mana patut boikot ye,Netral
Mon May 13 02:07:48 +0000 2024,guys nestle di boikot ngga?,Netral
Sat Apr 20 08:24:36 +0000 2024,Lagi solid reason nak boikot. Babi punya nestle tak pelik ramai orang msia kencing manis umur muda. Mati awal. Lepasni tolong bongkar lagi product product penipu ceni.,Netral
Fri Jun 14 04:02:14 +0000 2024,@_JANGAN_DIAM Nestle termasuk dalam produk boikot kot. Mmg takde masalah naikkan harga sbb takde kesan.,Netral
Sat May 04 10:17:40 +0000 2024,Salah satu kerugian bila boikot nestle,Netral
Tue Mar 19 13:43:55 +0000 2024,i thought nestle pun kena boikot. ke tak boikot dah. sebab influencer yang haritu jadi wakil rakyat tu pun dok promote nestle. tetiba video dia lalu kat fyp.,Netral
Mon Feb 19 15:05:27 +0000 2024,Dah lama tak makan ice cream sejak boikot nestle ni. Mostly ice cream kan dari walls. Dah la favourite ice cream boba Tealive dengan la cremeria choco mint. Nak makan eskremmm!!,Netral
Sat Jun 01 04:32:24 +0000 2024,Yg teriak2 boikot apakah kalau dikasih offering 2 digit di Nestle atau Unilever akan ditolak juga?,Netral
Tue May 21 00:44:51 +0000 2024,Boikot mekdi starbuck nestle dan... Zus je cukuplah tunjuk solidarity lmao,Netral
Tue Apr 16 06:04:58 +0000 2024,Aku rasa kedai ayam penyet aku selalu lepak ni boikot la produk nestle dah 3 hari aku datang order nescafe tak ada ni.,Netral
